{
  "$schema": "../../../../../schemas/state.schema.json",
  "feature_id": "example-medium",
  "complexity": "medium",
  "current_phase": "FINALIZE",
  "status": "done",
  "pending_gate": "finalize_complete",
  "owner_role": "orchestrator",
  "owner_id": "example-session-medium",
  "last_run_id": "RUN-012",
  "next_step": "Reuse this working set as the medium example for TASKS, EXECUTION CONTRACT, delegated analysis, explicit fan-in, and review-driven rework.",
  "blockers": [],
  "latest_evidence_refs": [
    ".specs/features/example-medium/finalize-report.md",
    ".specs/features/example-medium/run-history.json#RUN-011"
  ],
  "stale_evidence_refs": [],
  "rollback_target": "REVIEW",
  "updated_at": "2026-04-20T17:30:00Z"
}
